<!ELEMENT cardapio (prato+)>
<!ELEMENT prato (nome, descricao, ingredientes, preco, calorias, tempoPreparo)>
<!ATTLIST prato id ID #REQUIRED>
<!ELEMENT nome (#PCDATA)>
<!ELEMENT descricao (#PCDATA)>
<!ELEMENT ingredientes (#PCDATA)>
<!ELEMENT preco (#PCDATA)>
<!ELEMENT calorias (#PCDATA)>
<!ELEMENT tempoPreparo (#PCDATA)>